{
  "artifact_layout": {
    "incoming": "runs/run-20260722T183018661588Z-03d9cf49be/incoming",
    "logs": "runs/run-20260722T183018661588Z-03d9cf49be/logs",
    "run_dir": "runs/run-20260722T183018661588Z-03d9cf49be",
    "semantic_results": "runs/run-20260722T183018661588Z-03d9cf49be/semantic-results",
    "semantic_tasks": "runs/run-20260722T183018661588Z-03d9cf49be/semantic-tasks",
    "stage_results": "runs/run-20260722T183018661588Z-03d9cf49be/stage-results"
  },
  "authority_hint_rules": [
    {
      "hint": "Primary theory source for NARM definitions, developmental-trauma concepts, core needs, survival adaptations, regulation, therapeutic stance, and methods. It is not evidence of a personal diagnosis.\n",
      "path": "apex-meta/kb/therapy/raw/notes/ET-Heller-NARM.md",
      "score": 95
    },
    {
      "hint": "Primary personal working-formulation and support-boundary source. Treat all psychological statements as self-report or working hypotheses, not diagnosis.\n",
      "path": "apex-meta/kb/therapy/raw/notes/Psychological_Handover_Medical_Grade_v1.md",
      "score": 85
    },
    {
      "hint": "Personal reflection and support-framework source. Preserve its stated caution that it is not a formal diagnosis.\n",
      "path": "apex-meta/kb/therapy/raw/notes/PsychologicalHandover_ChatTherapeuticFramework_inACIM.md",
      "score": 80
    },
    {
      "hint": "Personal process-design source connecting betrayal, grief, anger, Jungian, Hawkins, ACIM, CBT, and practical-development ideas.\n",
      "path": "apex-meta/kb/therapy/raw/notes/MyTherapy.md",
      "score": 80
    },
    {
      "hint": "Operator self-report about goals, health constraints, energy limitations, and preferred therapeutic approaches. Do not infer medical diagnosis, treatment, prognosis, or exertion guidance.\n",
      "path": "apex-meta/kb/therapy/raw/notes/Anamesebogen.md",
      "score": 80
    },
    {
      "hint": "Source for surrender and Hawkins-oriented practice material. Treat it as a framework source, not clinical evidence.\n",
      "path": "apex-meta/kb/therapy/raw/notes/Notion_Surrender_Page.md",
      "score": 65
    },
    {
      "hint": "Source for practical intention encoding and embodied practice design. Distinguish its design claims from established clinical evidence.\n",
      "path": "apex-meta/kb/therapy/raw/notes/ManifestationHowTo.md",
      "score": 60
    },
    {
      "hint": "Personal insight source; preserve its stated maturity as a fresh breakthrough.",
      "path": "apex-meta/kb/therapy/raw/notes/shadow_insight_v1.md",
      "score": 60
    },
    {
      "hint": "Personal insight source; preserve its stated maturity as an unfolding insight.",
      "path": "apex-meta/kb/therapy/raw/notes/shadow_insight_v2.md",
      "score": 60
    },
    {
      "hint": "Personal insight source; preserve its stated maturity as unfolding pattern recognition.",
      "path": "apex-meta/kb/therapy/raw/notes/shadow_insight_v3.md",
      "score": 60
    }
  ],
  "config_hash": "03d9cf49be71c2b066ed7a1e774e4e24f12d05d2b9bc17c3de2a8d5b4bd4e390",
  "corpus_scope": {
    "authority_hint_rules": [
      {
        "hint": "Primary theory source for NARM definitions, developmental-trauma concepts, core needs, survival adaptations, regulation, therapeutic stance, and methods. It is not evidence of a personal diagnosis.\n",
        "path": "apex-meta/kb/therapy/raw/notes/ET-Heller-NARM.md",
        "score": 95
      },
      {
        "hint": "Primary personal working-formulation and support-boundary source. Treat all psychological statements as self-report or working hypotheses, not diagnosis.\n",
        "path": "apex-meta/kb/therapy/raw/notes/Psychological_Handover_Medical_Grade_v1.md",
        "score": 85
      },
      {
        "hint": "Personal reflection and support-framework source. Preserve its stated caution that it is not a formal diagnosis.\n",
        "path": "apex-meta/kb/therapy/raw/notes/PsychologicalHandover_ChatTherapeuticFramework_inACIM.md",
        "score": 80
      },
      {
        "hint": "Personal process-design source connecting betrayal, grief, anger, Jungian, Hawkins, ACIM, CBT, and practical-development ideas.\n",
        "path": "apex-meta/kb/therapy/raw/notes/MyTherapy.md",
        "score": 80
      },
      {
        "hint": "Operator self-report about goals, health constraints, energy limitations, and preferred therapeutic approaches. Do not infer medical diagnosis, treatment, prognosis, or exertion guidance.\n",
        "path": "apex-meta/kb/therapy/raw/notes/Anamesebogen.md",
        "score": 80
      },
      {
        "hint": "Source for surrender and Hawkins-oriented practice material. Treat it as a framework source, not clinical evidence.\n",
        "path": "apex-meta/kb/therapy/raw/notes/Notion_Surrender_Page.md",
        "score": 65
      },
      {
        "hint": "Source for practical intention encoding and embodied practice design. Distinguish its design claims from established clinical evidence.\n",
        "path": "apex-meta/kb/therapy/raw/notes/ManifestationHowTo.md",
        "score": 60
      },
      {
        "hint": "Personal insight source; preserve its stated maturity as a fresh breakthrough.",
        "path": "apex-meta/kb/therapy/raw/notes/shadow_insight_v1.md",
        "score": 60
      },
      {
        "hint": "Personal insight source; preserve its stated maturity as an unfolding insight.",
        "path": "apex-meta/kb/therapy/raw/notes/shadow_insight_v2.md",
        "score": 60
      },
      {
        "hint": "Personal insight source; preserve its stated maturity as unfolding pattern recognition.",
        "path": "apex-meta/kb/therapy/raw/notes/shadow_insight_v3.md",
        "score": 60
      }
    ],
    "exclusions": [],
    "lifecycle_hint_rules": [],
    "non_text_policy": "inventory_and_report",
    "output_root_exclusion": "C:\\GitDev\\apexai-os-meta\\apex-meta\\kb\\therapy-narm-personal-development",
    "source_handling": "pointer_only",
    "source_roots": [
      "apex-meta/kb/therapy/raw/notes"
    ]
  },
  "created_at": "2026-07-22T18:30:18Z",
  "destination": {
    "folder": "apex-meta/kb/therapy-narm-personal-development",
    "git": {
      "available": true,
      "branch": "main",
      "dirty": true,
      "error": null,
      "head": "cee4f36bf52d105d633330513df5533b3e3a79cd",
      "root": "C:\\GitDev\\apexai-os-meta"
    },
    "repository": "leela-spec/apexai-os-meta",
    "resolved_root": "C:\\GitDev\\apexai-os-meta",
    "resolved_run_root": "C:\\GitDev\\apexai-os-meta\\apex-meta\\kb\\therapy-narm-personal-development",
    "root": "C:\\GitDev\\apexai-os-meta"
  },
  "exclusions": [],
  "lifecycle_hint_rules": [],
  "previous_run": null,
  "run_id": "run-20260722T183018661588Z-03d9cf49be",
  "run_kind": "new",
  "run_options": {
    "ai_help_after_preflight": true,
    "git_metadata": true,
    "graph_depth": "process",
    "max_semantic_repairs": 3,
    "non_text": "inventory_and_report",
    "output": "query_ready",
    "semantic_depth": "deep",
    "source_handling": "pointer_only"
  },
  "schema": "apex.kb.run-manifest.v2",
  "schema_version": 2,
  "source": {
    "folders": [
      "apex-meta/kb/therapy/raw/notes"
    ],
    "git": {
      "available": true,
      "branch": "main",
      "dirty": true,
      "error": null,
      "head": "cee4f36bf52d105d633330513df5533b3e3a79cd",
      "root": "C:\\GitDev\\apexai-os-meta"
    },
    "ref": "main",
    "repository": "leela-spec/apexai-os-meta",
    "resolved_folders": [
      {
        "configured": "apex-meta/kb/therapy/raw/notes",
        "resolved": "C:\\GitDev\\apexai-os-meta\\apex-meta\\kb\\therapy\\raw\\notes"
      }
    ],
    "resolved_root": "C:\\GitDev\\apexai-os-meta",
    "root": "C:\\GitDev\\apexai-os-meta"
  },
  "topics": [
    {
      "aliases": [
        "NeuroAffective Relational Model",
        "relational trauma",
        "developmental needs",
        "survival adaptations"
      ],
      "ambiguous_terms": [
        "trauma",
        "attachment",
        "regulation"
      ],
      "expected_routes": {
        "dossier": "wiki/concepts/narm-model-and-core-needs.md",
        "source_atlas": "wiki/summaries/narm-model-and-core-needs-source-atlas.md"
      },
      "name": "NARM Model, Core Needs, Survival Adaptations, and Therapeutic Principles",
      "negative_terms": [
        "diagnosis",
        "cure"
      ],
      "primary_phrases": [
        "NARM",
        "developmental trauma",
        "contact survival structure",
        "core needs"
      ],
      "supporting_terms": [
        "connection",
        "attunement",
        "trust",
        "autonomy",
        "love and sexuality",
        "shame",
        "guilt",
        "contact",
        "disconnection",
        "regulation",
        "titration",
        "pendulation",
        "containment"
      ],
      "target_queries": [
        {
          "answer_requirements": [
            "Define each term from the NARM source with source pointers.",
            "Distinguish theory statements from personal application.",
            "Do not infer that the operator has a diagnosis or a particular survival style."
          ],
          "priority": "critical",
          "query_id": "narm-q01",
          "question": "What are NARM's core needs, survival adaptations, and central developmental-trauma concepts?"
        },
        {
          "answer_requirements": [
            "Name each method or principle.",
            "Explain its stated purpose and mechanism.",
            "State safety limits and when professional support is appropriate."
          ],
          "priority": "critical",
          "query_id": "narm-q02",
          "question": "Which NARM principles and methods address contact, disconnection, shame, regulation, and relational safety?"
        },
        {
          "answer_requirements": [
            "Use direct NARM source evidence.",